{
  "subject": "example.python.fib_only round-trip",
  "profile": "R",
  "preservation_level": "P1",
  "equivalence_mode": "trace",
  "normalized_observables": [],
  "dropped_observables": [
    "original local layout"
  ],
  "evidence": [
    "illustrative fixture only",
    "profile-qualified reconstruction claim"
  ]
}
